{
  "summary": "减少全片字幕密度并重建字幕轨",
  "costTier": "low",
  "requiresFullRender": true,
  "executionMode": "in_place",
  "intents": [
    {
      "target": "generation_plan.packaging",
      "operation": "reduce_subtitles",
      "params": {},
      "rationale": "用户希望减少字幕",
      "scope": "track_subtitle",
      "executionTool": "subtitle_patch"
    }
  ],
  "executionSteps": [
    {
      "tool": "subtitle_patch",
      "description": "降低字幕密度并重建字幕时间线"
    }
  ],
  "conversationSummary": "用户希望减少字幕"
}
